{
  "benchmark_id": "custom-vm-template-v1",
  "name": "Custom VM Benchmark Template",
  "description": "Schema-compatible template for privately owned or explicitly authorized custom VM targets.",
  "source": "Custom",
  "targets": [
    {
      "target_id": "custom-vm-placeholder",
      "name": "Custom VM Placeholder",
      "source": "Custom",
      "difficulty": "unknown",
      "os": "unknown",
      "scope": {
        "authorized_hosts": ["192.0.2.10"],
        "cidr_whitelist": ["192.0.2.10/32"],
        "target_url": "http://192.0.2.10/"
      },
      "expected_services": [
        {
          "service_id": "svc-custom-http",
          "host": "192.0.2.10",
          "port": 80,
          "protocol": "tcp",
          "service_name": "http"
        }
      ],
      "ground_truth_subtasks": [
        {
          "subtask_id": "subtask-custom-reachability",
          "category": "recon",
          "description": "Confirm authorized target reachability.",
          "success_evidence": "custom target reachable"
        }
      ],
      "ground_truth_vulnerabilities": [],
      "success_conditions": [
        "Replace placeholder host, services, vulnerabilities, and evidence before scoring a real VM."
      ],
      "allowed_tools": ["http_probe"],
      "max_steps": 100,
      "max_time_minutes": 120,
      "risk_level": "low",
      "notes": "Template uses RFC 5737 documentation address space and must be edited before use."
    }
  ]
}
