{
  "benchmark_id": "autopentester-htb10-skeleton-v1",
  "name": "AutoPentester HTB10 Alignment Skeleton",
  "description": "Schema-compatible placeholder for future authorized HTB10 comparison. It intentionally omits machine-specific write-up details.",
  "source": "HTB",
  "targets": [
    {
      "target_id": "htb10-authorized-placeholder",
      "name": "HTB10 Authorized Placeholder",
      "source": "HTB",
      "difficulty": "mixed",
      "os": "mixed",
      "scope": {
        "authorized_hosts": ["REPLACE_WITH_AUTHORIZED_HTB_VPN_HOST"],
        "cidr_whitelist": ["REPLACE_WITH_AUTHORIZED_HTB_CIDR"],
        "target_url": ""
      },
      "expected_services": [],
      "ground_truth_subtasks": [],
      "ground_truth_vulnerabilities": [],
      "success_conditions": [
        "Replace this skeleton with target-specific ground truth only after authorization is recorded."
      ],
      "allowed_tools": ["REPLACE_WITH_APPROVED_TOOLING"],
      "max_steps": 200,
      "max_time_minutes": 240,
      "risk_level": "medium",
      "notes": "Skeleton only. Do not use for live HTB evaluation until scope and allowed tools are explicit."
    }
  ]
}
